{"run": 60, "commit": "70a66a5", "metric": 0.3597, "samples": [0.3596, 0.3596, 0.3596, 0.3598, 0.3598, 0.3598], "metrics": {"time_ratio": 0.937, "time_samples": [0.9342, 0.9362, 0.9735, 0.9396, 0.9389, 0.9378, 0.9365, 0.9395, 0.9374], "guard_time": 0.4523, "guard_mem": 0.2826, "psr47_dag_s": 382.0, "psr47_dag_before_s": 526.5}, "confidence": 0, "status": "keep", "description": "frontier-search partition replaces union-find pair loop; psr47 -27%, guard -13%, probes +3.5% (accepted trade)", "timestamp": 1783963930, "segment": 2}
{"run": 61, "commit": "70a66a5", "metric": 0.3596, "samples": [0.3596, 0.3596, 0.3596], "metrics": {"time_ratio": 0.9402, "time_samples": [0.9402, 0.9344, 0.9416], "guard_time": 0.4564}, "confidence": 0, "status": "discard", "description": "word-wise mask save/restore instead of update_cost_context on the restore path: neutral on probes and guard, added complexity", "timestamp": 1783965671, "segment": 2}
{"run": 62, "commit": "a6407b3", "metric": 0.3595, "samples": [0.3595, 0.3595, 0.3595], "metrics": {"time_ratio": 0.869, "time_samples": [0.869, 0.8702, 0.8682], "guard_time": 0.4491, "guard_mem": 0.2825}, "confidence": 37.12, "status": "keep", "description": "word-mask negative/exhausted tracking + bit-scan simulated ops (removes two O(ops) passes per max node)", "timestamp": 1783967286, "segment": 2}
{"run": 63, "commit": "c3d8214", "metric": 0.359, "samples": [0.359, 0.359, 0.359], "metrics": {"time_ratio": 0.6108, "time_samples": [0.6091, 0.6129, 0.6104], "guard_time": 0.4007, "guard_mem": 0.2825}, "confidence": 174.4, "status": "keep", "description": "mask-only simulated contexts (word-wise live-bit clears; no context copy, no per-op updates)", "timestamp": 1783968754, "segment": 2}
{"run": 64, "commit": "5a5dced", "metric": 0.359, "samples": [0.359, 0.359, 0.359], "metrics": {"time_ratio": 0.5438, "time_samples": [0.5435, 0.5438, 0.5442], "guard_time": 0.3892, "guard_mem": 0.2824}, "confidence": 128.4, "status": "keep", "description": "sized-assignment gathers (restricted scratch, remaining abstractions, save buffer reserve) replace non-inlined push_back loops", "timestamp": 1783970665, "segment": 2}
{"run": 65, "commit": "5a5dced", "metric": 0.359, "samples": [0.359, 0.359, 0.359], "metrics": {"time_ratio": 0.5496, "time_samples": [0.5498, 0.5494, 0.5497]}, "confidence": 0, "status": "discard", "description": "branchless per-block diff masks + clean-run merging in matches(): +1% (64 ops per dirty block regardless of diff count)", "timestamp": 1783971810, "segment": 2}
{"run": 66, "commit": "7fdf9ab", "metric": 0.359, "samples": [0.359, 0.359, 0.359], "metrics": {"time_ratio": 0.549, "time_samples": [0.5492, 0.5491, 0.5484], "guard_time": 0.4004, "guard_mem": 0.2824}, "confidence": 0, "status": "keep", "description": "scaling budgets: conflict masks 512MiB (matrix kept separately at 64MiB, on-the-fly masks beyond), adaptive lookup cache (hash map above 1024 abstractions); probes/guard neutral, protective for 1000+-abstraction tasks", "timestamp": 1783978597, "segment": 2}
{"run": 67, "commit": "8cff1094", "metric": 0.3575, "samples": [0.3575, 0.3575, 0.3575], "metrics": {"time_ratio": 0.5387, "guard_time": 0.384, "guard_mem": 0.2788}, "confidence": 0, "status": "keep", "description": "consolidation audit: removed dead connected_components library (orphaned by frontier-search partition in run 60)", "timestamp": 1784026209, "segment": 2}
{"run": 68, "commit": "8cff1094", "metric": 0.3575, "samples": [0.3575, 0.3575, 0.3575], "metrics": {"time_ratio": 0.5387, "guard_time": 0.384, "guard_mem": 0.2788}, "confidence": 0, "status": "keep", "description": "consolidation audit: removed memo-probe-first (run 59, neutral after partition became cheap) + comment merge; re-ablated and KEPT layer-1 cost-key cache (2x) and static conflict matrix (guard +3.5%)", "timestamp": 1784026209, "segment": 2}
{"run": 69, "commit": "8cff1094", "metric": 0.3575, "samples": [0.3575, 0.3575, 0.3575], "metrics": {"grid_coverage": 661, "grid_coverage_09final": 665, "barman435_3_expansions_old": 133811610, "barman435_3_expansions_new": 133811610}, "confidence": 0, "status": "keep", "description": "verified cleaned-grid coverage 661 vs 665 is boundary noise: identical 133.8M A* expansions on the flipped task, ~30% wall-clock load swing on identical search work; cleanup behavior-preserving", "timestamp": 1784036615, "segment": 2}
