{"type":"config","name":"sscp-perf","metricName":"time_ratio","metricUnit":"ratio","bestDirection":"lower"}
{"run":1,"commit":"7a4141d","metric":0.9962,"samples":[0.9916,1.0082,0.9962],"metrics":{"mem_ratio":1.0},"confidence":0,"status":"keep","description":"baseline (identical binaries)","timestamp":1783813633,"segment":0}
{"run":2,"commit":"4290735","metric":1.0022,"samples":[0.9993,1.0022,1.0044],"metrics":{"mem_ratio":1.0001},"confidence":0,"status":"discard","description":"hash-index duplicate lookup tables in create_lookup_node instead of linear scan; no measurable win, table dedup scan is not a bottleneck on probe suite","timestamp":1783813957,"segment":0}
{"run":3,"commit":"0e5bb22","metric":0.9845,"samples":[0.9854,0.9793,0.9910,0.9936,0.9793,0.9836,0.9836,0.9924,0.9806,0.9796,0.9873,0.9893],"metrics":{"mem_ratio":1.0},"confidence":1.64,"status":"keep","description":"branchless/vectorizable reduce_costs{,_unguarded}; decide.py stuck at RERUN (confidence 1.6-2.0) due to 3-sample baseline, kept on sign test: 12/12 samples below baseline median, improvement 1.2% > noise floor 0.86%","timestamp":1783836096,"segment":0}
{"run":4,"commit":"985a507","metric":1.4012,"samples":[1.4012,1.3947,1.4085],"metrics":{"mem_ratio":1.0010},"confidence":0,"status":"discard","description":"flip cache_lookup_tables default to true: 40% SLOWER; compress_costs+hash per create_lookup_node call outweighs the tiny Dijkstras it saves (systematic(2) projections have ~100 states). Insight: cost key must be computed once per max node, not per lookup","timestamp":1783836465,"segment":0}
{"run":5,"commit":"99b6bd3","metric":0.7750,"samples":[0.7743,0.7759,0.7750],"metrics":{"mem_ratio":1.0031},"confidence":36.2,"status":"keep","description":"register cost key once per max node, pass to create_lookup_node; raw-vector cost cache (drop compress_costs); cache_lookup_tables default true -> avoids most goal distance recomputation","timestamp":1783836788,"segment":0}
{"run":6,"commit":"66b66ca","metric":0.7583,"samples":[0.7619,0.7523,0.7583],"metrics":{"mem_ratio":1.0030},"confidence":14.1,"status":"keep","description":"incremental op_has_negative_scf flags per child instead of per-op all_of over children","timestamp":1783837125,"segment":0}
{"run":7,"commit":"ba088da","metric":0.7685,"samples":[0.8205,0.7339,0.7721,0.7701,0.7592,0.7668],"metrics":{"mem_ratio":0.9993},"confidence":0,"status":"discard","description":"return scf by const ref (deque cache) and drop stored saturated_costs copies: no time win (slightly worse median), copies were not the cost; also lifetime caveat hurt clarity","timestamp":1783837666,"segment":0}
{"run":8,"commit":"ef864bf","metric":0.6193,"samples":[0.6238,0.6193,0.6154],"metrics":{"mem_ratio":1.0030},"confidence":25.0,"status":"keep","description":"early-exit in compute_independent_abstractions used loop index instead of pending abstraction id; fixing it lets the O(n^2) pair loop stop once all pending abstractions are connected","timestamp":1783837960,"segment":0}
{"run":9,"commit":"fd24629","metric":0.6100,"samples":[0.6100,0.6087,0.6123],"metrics":{"mem_ratio":1.0030},"confidence":3.5,"status":"keep","description":"fuse reduce_costs_unguarded with negative-scf flag tracking into one pass per child","timestamp":1783838244,"segment":0}
{"run":10,"commit":"4e06643","metric":0.6094,"samples":[0.6063,0.6094,0.6100],"metrics":{"mem_ratio":1.0032},"confidence":0,"status":"discard","description":"single-component fast path + sort-based grouping in DisjointSet::get_connected_components: within noise, and longer code than the map version","timestamp":1783838486,"segment":0}
{"run":11,"commit":"97ee268","metric":0.6170,"samples":[0.6120,0.6170,0.6320],"metrics":{"mem_ratio":1.0030},"confidence":0,"status":"discard","description":"track simulated_any_op flag instead of vector compare: within noise / slightly worse","timestamp":1783838854,"segment":0}
{"run":12,"commit":"114e5e3","metric":0.5556,"samples":[0.5575,0.5556,0.5539],"metrics":{"mem_ratio":1.0034},"confidence":24.5,"status":"keep","description":"mutable pq/label_costs/applicable_operators members in Projection::compute_goal_distances","timestamp":1783839122,"segment":0}
{"run":13,"commit":"5d71f13","metric":0.5393,"samples":[0.5393,0.5400,0.5383],"metrics":{"mem_ratio":1.0011},"confidence":12.9,"status":"keep","description":"uint64 word masks + per-call live/cond operator classification for dependency checks; drops gtl::bit_vector","timestamp":1783839516,"segment":0}
{"run":14,"commit":"a2d7ec2","metric":0.5422,"samples":[0.5422,0.5421,0.5440],"metrics":{"mem_ratio":1.0011},"confidence":0,"status":"keep","description":"clarity: remove dump_tree/dump_node, collect_time option+timers, dead compute_remaining_costs (-85 lines, metric neutral)","timestamp":1783839784,"segment":0}
{"run":15,"commit":"0a993aa","metric":0.5377,"samples":[0.5390,0.5377,0.5370],"metrics":{"mem_ratio":1.0010},"confidence":0,"status":"keep","description":"clarity: StructuredSCPOptions struct replaces g_hacked_* globals; validation centralized","timestamp":1783840106,"segment":0}
{"run":16,"commit":"c03b731","metric":0.5483,"samples":[0.5493,0.5442,0.5483],"metrics":{"mem_ratio":1.0011},"confidence":0,"status":"discard","description":"hoist remaining_costs/remaining_abstractions buffers out of the child loop: ~2% worse, fresh vectors beat capacity reuse here","timestamp":1783840417,"segment":0}
{"run":17,"commit":"6e1d261","metric":0.2587,"samples":[0.2587,0.2601,0.2587],"metrics":{"mem_ratio":1.0019},"confidence":537.7,"status":"keep","description":"cache PRUNED_LOOKUP sentinel for all-zero / dead-end-only lookup outcomes; these Dijkstras were recomputed on every cost function recurrence","timestamp":1783840706,"segment":0}
{"run":18,"commit":"2216798","metric":0.2522,"samples":[0.2488,0.2522,0.2529],"metrics":{"mem_ratio":1.0021},"confidence":12.5,"status":"keep","description":"single-component fast path in get_connected_components (retry of run 10 after run 17 shifted the profile)","timestamp":1783840919,"segment":0}
{"run":19,"commit":"c4a2233","metric":0.2371,"samples":[0.2371,0.2357,0.2375],"metrics":{"mem_ratio":1.0027},"confidence":18.5,"status":"keep","description":"SaturatedCostFunction struct with nonzero_ops; sparse reduce loops in create_max_node","timestamp":1783841252,"segment":0}
{"run":20,"commit":"533d836","metric":0.1959,"samples":[0.1956,0.1959,0.1963],"metrics":{"mem_ratio":0.9986},"confidence":79.4,"status":"keep","description":"deque scf_cache + const-ref get_saturated_costs; no per-child SCF copies (retry of run 7 after sparse SCFs made copies heavier)","timestamp":1783841542,"segment":0}
{"run":21,"commit":"57e4cf7","metric":0.1913,"samples":[0.1897,0.1935,0.1913],"metrics":{"mem_ratio":0.9984},"confidence":8.9,"status":"keep","description":"CostContext with incrementally maintained live/cond masks threaded through DAG construction","timestamp":1783842313,"segment":0}
{"run":22,"commit":"98be5a8","metric":0.1944,"samples":[0.1944,0.1944,0.1962],"metrics":{"mem_ratio":0.9985},"confidence":0,"status":"discard","description":"in-place CostContext mutation with undo (backtracking) instead of per-child copies: ~1.6% worse and hurts clarity (mutable scratch semantics)","timestamp":1783842572,"segment":0}
{"run":23,"commit":"0aa39f4","metric":0.1883,"samples":[0.1891,0.1863,0.1892,0.1874,0.1859,0.1896],"metrics":{"mem_ratio":0.9970},"confidence":1.52,"status":"keep","description":"dense [cost_key][abstraction] lookup cache instead of per-abstraction hash maps; kept on sign test (6/6 below all best samples) + memory win","timestamp":1783843051,"segment":0}
{"run":24,"commit":"04e5650","metric":0.1892,"samples":[0.1892,0.1878,0.1907],"metrics":{"mem_ratio":0.9970},"confidence":0,"status":"discard","description":"reusable member DisjointSet with sparse reset: no win, per-call allocations were not significant; reset contract adds subtlety","timestamp":1783843300,"segment":0}
{"run":25,"commit":"ce63324","metric":0.1895,"samples":[0.1909,0.1869,0.1895],"metrics":{"mem_ratio":0.9970},"confidence":0,"status":"keep","description":"clarity: non-const Instruction members, integer cache limit; neutral","timestamp":1783843536,"segment":0}
{"type":"config","name":"sscp-mem","metricName":"mem_ratio","metricUnit":"ratio","bestDirection":"lower"}
{"run":26,"commit":"c009a6f","metric":1.0,"samples":[1.0,1.0,1.0],"metrics":{"time_ratio":0.9994},"confidence":0,"status":"keep","description":"segment 1 baseline (identical binaries); time samples [1.0014,0.9809,0.9994]","timestamp":1783849250,"segment":1}
{"run":27,"commit":"ad188b4","metric":0.9429,"samples":[0.9429,0.9429,0.9429],"metrics":{"time_ratio":1.0090,"time_samples":[1.0090,1.0077,1.0082,1.0092,1.0110]},"confidence":99,"status":"keep","description":"packed cost function storage with raw-hash identification and packed verification; -5.7% memory, +0.9% time (within guard)","timestamp":1783851177,"segment":1}
{"run":28,"commit":"113c15e","metric":0.8530,"samples":[0.8530,0.8530,0.8530],"metrics":{"time_ratio":0.9442,"time_samples":[0.9420,0.9442,0.9452]},"confidence":99,"status":"keep","description":"transparent node-set dedup caches (no per-entry key vector copies): -9.5% memory AND 6% faster","timestamp":1783851506,"segment":1}
{"run":29,"commit":"4f8cb2b","metric":0.8056,"samples":[0.8056,0.8056,0.8056],"metrics":{"time_ratio":0.9573,"time_samples":[0.9573,0.9573,0.9594]},"confidence":99,"status":"keep","description":"free construction caches before instruction phase + release node children after their instruction is built: -5.6% memory","timestamp":1783851847,"segment":1}
{"run":30,"commit":"cd0718b","metric":0.7596,"samples":[0.7596,0.7596,0.7596],"metrics":{"time_ratio":0.9433,"time_samples":[0.9433,0.9447,0.9425]},"confidence":99,"status":"keep","description":"flattened Instructions struct (types/id_offsets/ids in shared buffers): -5.7% memory, fastest segment time","timestamp":1783852203,"segment":1}
{"run":31,"commit":"50a560b","metric":0.6442,"samples":[0.6442,0.6442,0.6442],"metrics":{"time_ratio":0.7909,"time_samples":[0.7909,0.7903,0.8096]},"confidence":99,"status":"keep","description":"flat arena of SSCPNode structs with integer node ids: -15% memory and 16% faster; also fixes static counter reuse bug","timestamp":1783853437,"segment":1}
{"run":32,"commit":"bfd89ed","metric":0.5288,"samples":[0.5288,0.5288,0.5288],"metrics":{"time_ratio":0.7770,"time_samples":[0.7779,0.7744,0.7770]},"confidence":99,"status":"keep","description":"shared children pool with per-node slices instead of vector<NodeId> per node: -18% memory, time also improved","timestamp":1783853824,"segment":1}
{"run":33,"commit":"16196a7","metric":0.5288,"samples":[0.5288,0.5288,0.5288],"metrics":{"time_ratio":0.7730,"time_samples":[0.7703,0.7780,0.7730]},"confidence":0,"status":"keep","description":"clarity: drop level field, sort reachable nodes by id (arena order is topological); neutral","timestamp":1783854359,"segment":1}
{"run":34,"commit":"142b895","metric":0.3241,"samples":[0.3241,0.3241,0.3241],"metrics":{"time_ratio":0.9264,"time_samples":[0.9264,0.9267,0.9251]},"confidence":99,"status":"keep","description":"ALGORITHMIC: intersection-based conflicts + inf-donation terms instead of union; rovers06 DAG 2.88M -> 14.6k nodes, mem -39%; h values verified equal","timestamp":1783857035,"segment":1}
{"run":35,"commit":"6cadf0e","metric":0.6005,"samples":[0.6005,0.6005,0.6005],"metrics":{"time_ratio":0.8544,"time_samples":[0.8699,0.8544,0.8728]},"confidence":0,"status":"discard","description":"input-keyed memoization of create_max_node: time 0.93->0.86 but memory 0.32->0.60 (too many input-key entries); first attempt without the scheduled-key layer even caused exponential re-expansion (satellite timeout)","timestamp":1783857745,"segment":1}
{"run":36,"commit":"8ff18c0","metric":0.3241,"samples":[0.3241,0.3241,0.3241],"metrics":{"time_ratio":0.7939,"time_samples":[0.7946,0.7936,0.7939]},"confidence":99,"status":"keep","description":"static pair-conflict bit matrix skips statically independent pairs in the O(n^2) loops; reclaims most of run 34's time cost","timestamp":1783858147,"segment":1}
{"run":37,"commit":"0dd2ad0","metric":0.4289,"samples":[0.4289,0.4289,0.4289],"metrics":{"time_ratio":0.6462,"time_samples":[0.6505,0.6441,0.6462]},"confidence":0,"status":"discard","description":"interned-set memoization incl. input keys: time 0.65 but mem 0.43 (entry per distinct call signature); rejected in memory-primary segment, noted as time-leaning alternative","timestamp":1783858994,"segment":1}
{"run":38,"commit":"0dd2ad0","metric":0.3033,"samples":[0.3033,0.3033,0.3033],"metrics":{"time_ratio":0.7870,"time_samples":[0.7931,0.7794,0.7870]},"confidence":99,"status":"keep","description":"scheduled-set cache keyed by packed (cost key, interned set id): mem 0.324->0.303, time ~equal","timestamp":1783858994,"segment":1}
{"run":39,"commit":"8415c9d","metric":0.3034,"samples":[0.3034,0.3034,0.3034],"metrics":{"time_ratio":0.6419,"time_samples":[0.6421,0.6419,0.6383]},"confidence":99,"status":"keep","description":"cost key carried in CostContext (register once per context) + read-only entry probe of the scheduled-set cache: time 0.786->0.640 at unchanged memory; Pareto-dominates run 37's trade-off","timestamp":1783864072,"segment":1}
{"run":40,"commit":"42f02cc","metric":0.3234,"samples":[0.3234,0.3234,0.3234],"metrics":{"time_ratio":0.5220,"time_samples":[0.5220,0.5211,0.5238]},"confidence":99,"status":"keep","description":"ALGORITHMIC: per-abstraction lookup table cache keyed by costs restricted to relevant ops; collapses 2.7M Dijkstras to distinct restrictions","timestamp":1783864426,"segment":1}
{"run":41,"commit":"4db8aee","metric":0.3049,"samples":[0.3049,0.3049,0.3049],"metrics":{"time_ratio":0.5294,"time_samples":[0.5294,0.5383,0.5294]},"confidence":99,"status":"keep","description":"bit-packed cost blob pool (power-of-two widths, vectorizable pack, memcmp verify): suite mem 0.323->0.305, driverlog 933->649MB, time ~equal; serial bit-shift packing and unpack-verify variants cost +7-9% time and were rejected","timestamp":1783866691,"segment":1}
{"run":42,"commit":"e7f120c","metric":0.3049,"samples":[0.3049,0.3049,0.3049],"metrics":{"time_ratio":0.5243,"time_samples":[0.5243,0.5243,0.5232]},"confidence":99,"status":"keep","description":"rolling content hash in CostContext (O(delta) updates) + fused reduce_cost_context; removes full-vector rehash per registration","timestamp":1783867044,"segment":1}
{"run":43,"commit":"4439264","metric":0.2978,"samples":[0.2978,0.2978,0.2978],"metrics":{"time_ratio":0.5163,"time_samples":[0.5249,0.5144,0.5163]},"confidence":99,"status":"keep","description":"int16 lookup table cache rows with overflow map for large id ranges: mem 0.305->0.298, time ~equal","timestamp":1783869329,"segment":1}
{"run":44,"commit":"f7d9f83","metric":0.2974,"samples":[0.2974,0.2974,0.2974],"metrics":{"time_ratio":0.5056,"time_samples":[0.5056,0.5009,0.5075]},"confidence":99,"status":"keep","description":"in-place context reduction with sparse per-frame undo (successful retry of run 22 after contexts gained hash/key and calls got fewer)","timestamp":1783869613,"segment":1}
{"run":45,"commit":"ad35e21","metric":0.2974,"samples":[0.2974,0.2974,0.2974],"metrics":{"time_ratio":0.5017,"time_samples":[0.5017,0.5015,0.5089]},"confidence":0,"status":"keep","description":"consolidation: remove orphaned NodeKey/NodeKeyHash/PairUint32VectorIntHash/VectorUint8MurmurHash; neutral","timestamp":1783874679,"segment":1}
{"run":46,"commit":"1642859","metric":0.2975,"samples":[0.2975,0.2975,0.2975],"metrics":{"time_ratio":0.5191,"time_samples":[0.5263,0.5191,0.5112]},"confidence":0,"status":"discard","description":"ABLATION: removing live/cond context masks (per-bit cost tests on sparse conflict masks instead) costs ~2.7% time; the mask machinery from runs 13/21 still earns its keep","timestamp":1783875113,"segment":1}
{"run":47,"commit":"1abf2c5","metric":0.2974,"samples":[0.2974,0.2974,0.2974],"metrics":{"time_ratio":0.6041,"time_samples":[0.5944,0.6041,0.6105]},"confidence":0,"status":"discard","description":"ABLATION: removing the static pair-conflict matrix costs ~17% time; run 36 earns its keep","timestamp":1783875332,"segment":1}
{"run":48,"commit":"82acc42","metric":0.2979,"samples":[0.2979,0.2979,0.2979],"metrics":{"time_ratio":0.5420,"time_samples":[0.5420,0.5311,0.5461]},"confidence":0,"status":"discard","description":"ABLATION: removing the single-component fast path in get_connected_components costs ~6% time; run 18 earns its keep","timestamp":1783875530,"segment":1}
{"run":49,"commit":"cafbabc","metric":0.2974,"samples":[0.2974,0.2974,0.2974],"metrics":{"time_ratio":0.5871,"time_samples":[0.6073,0.5871,0.5638]},"confidence":0,"status":"discard","description":"ABLATION: removing the read-only entry probe costs ~14% time; run 39 earns its keep","timestamp":1783875749,"segment":1}
{"run":50,"commit":"a525580","metric":0.2974,"samples":[0.2974,0.2974,0.2974],"metrics":{"time_ratio":0.5257,"time_samples":[0.5156,0.5257,0.5271]},"confidence":0,"status":"keep","description":"clarity: split generator into sscp_dag.h + cost_function_registry.{h,cc}; sentinels unified, lookup_nodes renamed; neutral","timestamp":1783881051,"segment":1}
{"run": 51, "commit": "a3898cb", "metric": 0.2974, "samples": [0.2974, 0.2974, 0.2974], "metrics": {"time_ratio": 0.516, "time_samples": [0.516, 0.521, 0.5153]}, "confidence": 0, "status": "keep", "description": "budgeted restricted-cost table maps (drop when sharing doesn't pay): fixes scanalyzer/tetris 8GiB OOM regression from run 40 seen on the grid; probes neutral", "timestamp": 1783901409, "segment": 1}
{"type": "config", "name": "sscp-dag-memory", "metricName": "mem_ratio", "metricUnit": "ratio", "bestDirection": "lower"}
{"run": 52, "commit": "47e712e", "metric": 0.9882, "samples": [0.9882, 0.9882], "metrics": {"time_ratio": 0.9584, "time_samples": [0.9584, 0.9875], "guard_time": 0.5186, "guard_mem": 0.2971}, "confidence": 0, "status": "keep", "description": "sparse SaturatedCostFunction (parallel nonzero ops/costs, dense vector and dead dense reducer removed)", "timestamp": 1783928972, "segment": 2}
{"run": 53, "commit": "d89b0e4", "metric": 0.9032, "samples": [0.9032, 0.9032, 0.9032], "metrics": {"time_ratio": 0.9315, "time_samples": [0.9315, 0.9302, 0.9285], "guard_time": 0.5149, "guard_mem": 0.294}, "confidence": 0, "status": "keep", "description": "registry blobs as diff bitmask + changed values vs first cost function (was: dense packed copies)", "timestamp": 1783930877, "segment": 2}
{"run": 54, "commit": "d046537", "metric": 0.8787, "samples": [0.8787, 0.8787, 0.8787], "metrics": {"time_ratio": 0.9827, "time_samples": [0.9827, 0.9828, 0.984, 0.9823, 0.982, 0.9902], "guard_time": 0.5431, "guard_mem": 0.2885, "note": "time measured at load ~50, recheck when quiet"}, "confidence": 0, "status": "keep", "description": "SSCPNode 32->16 bytes via anonymous unions (children slice vs lookup table position)", "timestamp": 1783933912, "segment": 2}
{"run": 55, "commit": "e26c8b4", "metric": 0.6071, "samples": [0.6071, 0.6071, 0.6071], "metrics": {"time_ratio": 0.9767, "time_samples": [0.9767, 0.9779, 0.9776], "guard_time": 0.5126, "guard_mem": 0.2952, "note": "times at load ~42"}, "confidence": 0, "status": "keep", "description": "chunked BlobPool for registry verification blobs (kills doubling-realloc transient, 83% of mprime peak)", "timestamp": 1783936102, "segment": 2}
{"run": 56, "commit": "4c73c82", "metric": 0.6076, "samples": [0.6076, 0.6076, 0.6076], "metrics": {"time_ratio": 0.9558, "time_samples": [0.9558, 0.9575, 0.9543], "guard_time": 0.5354, "guard_mem": 0.2952, "scanalyzer22_peak_kb": 338936, "scanalyzer22_ref_kb": 550392}, "confidence": 0, "status": "keep", "description": "geometric hit-rate checkpoints drop useless restricted-cost maps early (first version had next_check > budget floor bug: snake04 3x worse; fixed by clamping)", "timestamp": 1783940826, "segment": 2}
{"run": 57, "commit": "1af4250", "metric": 0.4184, "samples": [0.4184, 0.4184, 0.4184], "metrics": {"time_ratio": 0.9783, "time_samples": [0.9783, 0.9802, 0.9784], "guard_time": 0.5289, "guard_mem": 0.2816, "note": "iterations: fixed 4MiB chunks (mem 0.68), SWAR pack (time 1.19) both rejected; final: one-pass matches() + murmur restricted hash"}, "confidence": 0, "status": "keep", "description": "per-abstraction CostFunctionRegistry for restricted keys + adaptive chunks + one-pass blob verification", "timestamp": 1783947171, "segment": 2}
{"run": 58, "commit": "39d6615", "metric": 0.3597, "samples": [0.3597, 0.3597, 0.3597], "metrics": {"time_ratio": 0.9232, "time_samples": [0.9501, 0.9086, 0.911], "guard_time": 0.5486, "guard_mem": 0.2827}, "confidence": 0, "status": "keep", "description": "two-level diff masks (dirty-block bitmap + per-block 64-bit masks); per-value width dispatch rejected (time 1.26)", "timestamp": 1783951677, "segment": 2}
{"run": 59, "commit": "301588b", "metric": 0.3597, "samples": [0.3597, 0.3597, 0.3597], "metrics": {"time_ratio": 0.9017, "time_samples": [0.9052, 0.9017, 0.9071, 0.8921, 0.8889, 0.8913, 0.902, 0.8959, 0.8992], "guard_time": 0.5198, "guard_mem": 0.2812}, "confidence": 1.71, "status": "keep", "description": "probe max-node memo before partitioning remaining set (exact DAG-preserving skip of dead quadratic work); kept on sign test 9/9 vs noisy baseline", "timestamp": 1783959315, "segment": 2}
